{
  "proto": "HBCE-EVIDENCE-BUNDLE-v2",
  "kind": "HBCE_PUBLIC_EVIDENCE_BUNDLE",
  "policy": [
    "EU_FIRST",
    "AUDIT_FIRST",
    "HASH_ONLY",
    "FAIL_CLOSED",
    "GDPR_MIN",
    "NO_PUBLIC_DATA_CUSTODY"
  ],
  "payload_sha256": "aaaaaaaaaaaaaaaaaaaaaaaaaaaaaaaaaaaaaaaaaaaaaaaaaaaaaaaaaaaaaaaa",
  "timestamp": "2026-05-06T00:00:00.000Z",
  "subject_label": "HBCE_PUBLIC_DEMO_001",
  "record_scope": "VERIFY_DEMO_PUBLIC_PROOF",
  "PAYLOAD_MIN": {
    "summary": "Synthetic public verification demo bundle for HBCE Verify. This example contains no real personal data, no private evidence, no credentials, and no sensitive operational payload.",
    "record_type": "SYNTHETIC_VERIFY_DEMO",
    "source": "verify/demo-evidence.json",
    "public_reference": "HBCE_VERIFY_DEMO"
  },
  "CONTACT_SIGNALS": {
    "contact_commitment_sha256": "bbbbbbbbbbbbbbbbbbbbbbbbbbbbbbbbbbbbbbbbbbbbbbbbbbbbbbbbbbbbbbbb"
  },
  "NOTE": "Synthetic evidence bundle for client-side verification testing. Replace payload_sha256 only with a real hash commitment generated from a controlled non-sensitive payload."
}
